Welcome to Employee Payroll Service

UC1:

mysql> create database payroll_service;
Query OK, 1 row affected (2.12 sec)

mysql> show databases;
+--------------------+
| Database           |
+--------------------+
| information_schema |
| mysql              |
| pavani             |
| payroll_service    |
| performance_schema |
| suma               |
| sys                |
+--------------------+
7 rows in set (0.79 sec)

mysql> use payroll_service;
Database changed

UC2:

mysql> create table employee_payroll
    -> (id int not null auto_increment,
    -> name varchar(150) not null,
    -> salary Double not null,
    -> start date not null,
    -> primary key(id));
Query OK, 0 rows affected (3.07 sec)

mysql> desc employee_payroll
    -> ;
+--------+--------------+------+-----+---------+----------------+
| Field  | Type         | Null | Key | Default | Extra          |
+--------+--------------+------+-----+---------+----------------+
| id     | int          | NO   | PRI | NULL    | auto_increment |
| name   | varchar(150) | NO   |     | NULL    |                |
| salary | double       | NO   |     | NULL    |                |
| start  | date         | NO   |     | NULL    |                |
+--------+--------------+------+-----+---------+----------------+
4 rows in set (0.28 sec)

UC3:

mysql> insert into employee_payroll (name, salary, start)
    -> values('Pavani', 25000, '2022-01-01');
Query OK, 1 row affected (0.18 sec)

mysql> insert into employee_payroll (name, salary, start)
    -> values('Anitha', 30000, '2022-02-01');
Query OK, 1 row affected (0.15 sec)

mysql> insert into employee_payroll (name, salary, start)
    -> values('Priya', 40000, '2022-03-01');
Query OK, 1 row affected (0.10 sec)

UC4:

mysql> select * from employee_payroll;
+----+--------+--------+------------+
| id | name   | salary | start      |
+----+--------+--------+------------+
|  1 | Pavani |  25000 | 2022-01-01 |
|  2 | Anitha |  30000 | 2022-02-01 |
|  3 | Priya  |  40000 | 2022-03-01 |
+----+--------+--------+------------+
3 rows in set (0.06 sec)

UC5:

mysql> select salary from employee_payroll where name = 'Anitha';
+--------+
| salary |
+--------+
|  30000 |
+--------+
1 row in set (0.08 sec)

mysql> select salary from employee_payroll where start between cast('2018-01-01' as date) and date(now());
+--------+
| salary |
+--------+
|  25000 |
|  30000 |
|  40000 |
+--------+
3 rows in set (0.10 sec)

mysql> select * from employee_payroll where start between cast('2018-01-01' as date) and date(now());
+----+--------+--------+------------+
| id | name   | salary | start      |
+----+--------+--------+------------+
|  1 | Pavani |  25000 | 2018-01-01 |
|  2 | Anitha |  30000 | 2019-02-02 |
|  3 | Priya  |  40000 | 2020-03-03 |
+----+--------+--------+------------+
3 rows in set (0.00 sec)

UC6:

mysql> alter table employee_payroll add gender char(1) after name;
Query OK, 0 rows affected (3.34 sec)
Records: 0  Duplicates: 0  Warnings: 0

mysql> desc employee_Payroll;
+--------+--------------+------+-----+---------+----------------+
| Field  | Type         | Null | Key | Default | Extra          |
+--------+--------------+------+-----+---------+----------------+
| id     | int          | NO   | PRI | NULL    | auto_increment |
| name   | varchar(150) | NO   |     | NULL    |                |
| gender | char(1)      | YES  |     | NULL    |                |
| salary | double       | NO   |     | NULL    |                |
| start  | date         | NO   |     | NULL    |                |
+--------+--------------+------+-----+---------+----------------+
5 rows in set (0.04 sec)

mysql> update employee_payroll set gender = 'F' where name = 'Anitha';
Query OK, 1 row affected (0.07 sec)
Rows matched: 1  Changed: 1  Warnings: 0

mysql> select * from employee_payroll;
+----+--------+--------+--------+------------+
| id | name   | gender | salary | start      |
+----+--------+--------+--------+------------+
|  1 | Pavani | NULL   |  25000 | 2018-01-01 |
|  2 | Anitha | F      |  30000 | 2019-02-02 |
|  3 | Priya  | NULL   |  40000 | 2020-03-03 |
+----+--------+--------+--------+------------+
3 rows in set (0.00 sec)

mysql> update employee_payroll set gender = 'F' where name = 'Pavani' or name = 'Priya';
Query OK, 2 rows affected (0.14 sec)
Rows matched: 2  Changed: 2  Warnings: 0

mysql> select * from employee_payroll;
+----+--------+--------+--------+------------+
| id | name   | gender | salary | start      |
+----+--------+--------+--------+------------+
|  1 | Pavani | F      |  25000 | 2018-01-01 |
|  2 | Anitha | F      |  30000 | 2019-02-02 |
|  3 | Priya  | F      |  40000 | 2020-03-03 |
+----+--------+--------+--------+------------+
3 rows in set (0.00 sec)

UC7:

mysql> select sum(salary) from employee_payroll where gender = 'F' group by gender;
+-------------+
| sum(salary) |
+-------------+
|       95000 |
+-------------+
1 row in set (0.06 sec)

mysql> select avg(salary) from employee_payroll where gender = 'F' group by gender;
+--------------------+
| avg(salary)        |
+--------------------+
| 31666.666666666668 |
+--------------------+
1 row in set (0.00 sec)

mysql> select gender,max(salary) from employee_payroll group by gender;
+--------+-------------+
| gender | max(salary) |
+--------+-------------+
| F      |       40000 |
+--------+-------------+
1 row in set (0.08 sec)

mysql> select gender,min(salary) from employee_payroll group by gender;
+--------+-------------+
| gender | min(salary) |
+--------+-------------+
| F      |       25000 |
+--------+-------------+
1 row in set (0.00 sec)

mysql> select gender,count(salary) from employee_payroll group by gender;
+--------+---------------+
| gender | count(salary) |
+--------+---------------+
| F      |             3 |
+--------+---------------+
1 row in set (0.00 sec)

UC8:

mysql> alter table employee_payroll add phone_number varchar(20) after name;
Query OK, 0 rows affected (2.83 sec)
Records: 0  Duplicates: 0  Warnings: 0

mysql> alter table employee_payroll add address varchar(50) after phone_number;
Query OK, 0 rows affected (1.72 sec)
Records: 0  Duplicates: 0  Warnings: 0

mysql> alter table employee_payroll add department varchar(40) after address;
Query OK, 0 rows affected (1.52 sec)
Records: 0  Duplicates: 0  Warnings: 0

mysql> desc employee_payroll;
+--------------+--------------+------+-----+---------+----------------+
| Field        | Type         | Null | Key | Default | Extra          |
+--------------+--------------+------+-----+---------+----------------+
| id           | int          | NO   | PRI | NULL    | auto_increment |
| name         | varchar(150) | NO   |     | NULL    |                |
| phone_number | varchar(20)  | YES  |     | NULL    |                |
| address      | varchar(50)  | YES  |     | NULL    |                |
| department   | varchar(40)  | YES  |     | NULL    |                |
| gender       | char(1)      | YES  |     | NULL    |                |
| salary       | double       | NO   |     | NULL    |                |
| start        | date         | NO   |     | NULL    |                |
+--------------+--------------+------+-----+---------+----------------+
8 rows in set (0.10 sec)

UC9:

mysql> alter table employee_payroll add basic_pay Double after department;
Query OK, 0 rows affected (2.46 sec)
Records: 0  Duplicates: 0  Warnings: 0

mysql> alter table employee_payroll add deductions Double after basic_pay;
Query OK, 0 rows affected (2.23 sec)
Records: 0  Duplicates: 0  Warnings: 0

mysql> alter table employee_payroll add taxable_pay Double after deductions;
Query OK, 0 rows affected (2.21 sec)
Records: 0  Duplicates: 0  Warnings: 0

mysql> alter table employee_payroll add income_tax Double after taxable_pay;
Query OK, 0 rows affected (2.35 sec)
Records: 0  Duplicates: 0  Warnings: 0

mysql> alter table employee_payroll add net_pay Double after income_tax;
Query OK, 0 rows affected (2.17 sec)
Records: 0  Duplicates: 0  Warnings: 0

mysql> desc employee_payroll;
+--------------+--------------+------+-----+---------+----------------+
| Field        | Type         | Null | Key | Default | Extra          |
+--------------+--------------+------+-----+---------+----------------+
| id           | int          | NO   | PRI | NULL    | auto_increment |
| name         | varchar(150) | NO   |     | NULL    |                |
| phone_number | varchar(20)  | YES  |     | NULL    |                |
| address      | varchar(50)  | YES  |     | NULL    |                |
| department   | varchar(40)  | YES  |     | NULL    |                |
| basic_pay    | double       | YES  |     | NULL    |                |
| deductions   | double       | YES  |     | NULL    |                |
| taxable_pay  | double       | YES  |     | NULL    |                |
| income_tax   | double       | YES  |     | NULL    |                |
| net_pay      | double       | YES  |     | NULL    |                |
| gender       | char(1)      | YES  |     | NULL    |                |
| salary       | double       | NO   |     | NULL    |                |
| start        | date         | NO   |     | NULL    |                |
+--------------+--------------+------+-----+---------+----------------+
13 rows in set (0.09 sec)

UC10:

mysql> insert into employee_payroll
    -> (name, phone_number, address, department, basic_pay, deductions, taxable_pay, income_tax, net_pay, gender, salary, start)
    -> values('Pavani', '965431235', 'chennai', 'marketing', 15000, 3000, 1000, 8000, 5000, 'F', 35000, '2018-04-04');
Query OK, 1 row affected (0.06 sec)

mysql> select * from employee_payroll where name = 'Pavani';
+----+--------+--------------+---------+------------+-----------+------------+-------------+------------+---------+--------+--------+------------+
| id | name   | phone_number | address | department | basic_pay | deductions | taxable_pay | income_tax | net_pay | gender | salary | start      |
+----+--------+--------------+---------+------------+-----------+------------+-------------+------------+---------+--------+--------+------------+
|  1 | Pavani | NULL         | NULL    | NULL       |      NULL |       NULL |        NULL |       NULL |    NULL | F      |  25000 | 2018-01-01 |
|  4 | Pavani | 965431235    | chennai | marketing  |     15000 |       3000 |        1000 |       8000 |    5000 | F      |  35000 | 2018-04-04 |
+----+--------+--------------+---------+------------+-----------+------------+-------------+------------+---------+--------+--------+------------+
2 rows in set (0.00 sec)

UC11:

mysql> create table department (department varchar(45) not null, primary key(department));
Query OK, 0 rows affected (1.20 sec)

mysql> insert into department (department) values('sales'), ('marketing');
Query OK, 2 rows affected (0.17 sec)
Records: 2  Duplicates: 0  Warnings: 0

mysql> select * from department;
+------------+
| department |
+------------+
| marketing  |
| sales      |
+------------+
2 rows in set (0.00 sec)


mysql>  create table employee(id int, phone_number BIGINT(10), address varchar(40), gender char(1), primary key(id));
Query OK, 0 rows affected, 1 warning (0.51 sec)

mysql> insert into employee(id, phone_number, address, gender)
    -> values(1, 9853423456, 'Bangalore', 'F');
Query OK, 1 row affected (0.23 sec)

mysql> insert into employee(id, phone_number, address, gender)
    -> values(2, 9853454456, 'Tirupati', 'F');
Query OK, 1 row affected (0.10 sec)

mysql> select * from employee;
+----+--------------+-----------+--------+
| id | phone_number | address   | gender |
+----+--------------+-----------+--------+
|  1 |   9853423456 | Bangalore | F      |
|  2 |   9853454456 | Tirupati  | F      |
+----+--------------+-----------+--------+
2 rows in set (0.00 sec)

mysql> create table Emp_Department (empID int, Depart varchar(250) NOT NULL, FOREIGN KEY (empID) REFERENCES Employee (id),
    -> FOREIGN KEY (Depart) REFERENCES Department (department), PRIMARY KEY (empID, Depart));
Query OK, 0 rows affected (2.86 sec)

mysql> desc Emp_Department;
+--------+--------------+------+-----+---------+-------+
| Field  | Type         | Null | Key | Default | Extra |
+--------+--------------+------+-----+---------+-------+
| empID  | int          | NO   | PRI | NULL    |       |
| Depart | varchar(250) | NO   | PRI | NULL    |       |
+--------+--------------+------+-----+---------+-------+
2 rows in set (0.17 sec)

mysql> insert into Emp_Department (empID, Depart) VALUES (1, 'Marketing');
Query OK, 1 row affected (0.23 sec)

mysql> select * from Emp_Department;
+-------+-----------+
| empID | Depart    |
+-------+-----------+
|     1 | Marketing |
+-------+-----------+
1 row in set (0.00 sec)
